id,listing_url,scrape_id,last_scraped,name2,summary,space,description,experiences_offered,neighborhood_overview,notes,transit,access,interaction,house_rules,thumbnail_url,medium_url,picture_url,xl_picture_url,host_id,host_url,host_name,host_since,host_location,host_about,host_response_time,host_response_rate,host_acceptance_rate,host_is_superhost,host_thumbnail_url,host_picture_url,host_neighbourhood,host_listings_count,host_total_listings_count,host_verifications,host_has_profile_pic,host_identity_verified,street,neighbourhood,neighbourhood_cleansed,neighbourhood_group_cleansed,city,state,zipcode,market,smart_location,country_code,country,latitude,longitude,is_location_exact,property_type,room_type,accommodates,bathrooms,bedrooms,beds,bed_type,amenities,square_feet,price,weekly_price,monthly_price,security_deposit,cleaning_fee,guests_included,extra_people,minimum_nights,maximum_nights,minimum_minimum_nights,maximum_minimum_nights,minimum_maximum_nights,maximum_maximum_nights,minimum_nights_avg_ntm,maximum_nights_avg_ntm,calendar_updated,has_availability,availability_30,availability_60,availability_90,availability_365,calendar_last_scraped,number_of_reviews,number_of_reviews_ltm,first_review,last_review,review_scores_rating,review_scores_accuracy,review_scores_cleanliness,review_scores_checkin,review_scores_communication,review_scores_location,review_scores_value,requires_license,license,jurisdiction_names,instant_bookable,is_business_travel_ready,cancellation_policy,require_guest_profile_picture,require_guest_phone_verification,calculated_host_listings_count,calculated_host_listings_count_entire_homes,calculated_host_listings_count_private_rooms,calculated_host_listings_count_shared_rooms,reviews_per_month
26654,https://www.airbnb.com/rooms/26654,20200316134823,2020-03-16,World Class downtown @CN Tower Theatre MTCC games!,"CN Tower, TIFF Bell Lightbox, Metro Convention Centre, Princess of Wales Theatre, Rogers/ Air Canada Centre, Bell Lightbox, all within 1 minute walk. You will end up here during your visit to Toronto! Why not stay with us on location? You'll be glad you did.","Welcome to 5***** Living - Bohemian decor~ in the Heartbeat of Toronto's ENTERTAINMENT DISTRICT at this Urban Hotel Alternative. Welcome to warm downtown Living - Chic 1 + 1 Bedroom Condo Luxuriously furnished with Contemporary stylings.  Step inside and you are a million miles from it all, step out and you could be in the middle of a shakespeare re-enactment.  Get the most the city has to offer as shopping, dining, sports and theater are all within walking distance.  Situated in the heart of Toronto's Entertainment district, this unique Condominium shares an intersection with the exclusive SOHO Met and features 775 sqft of artistic déco. leaving no amenity spared. Feel like Home with Salvador Dali and friends on your wall.   Enjoy a South facing view of or walk 1 minute to the CN Tower,  Upscale Finishings,  1 Queen Sized bed, 1 Double Bed, 24-Hour Security,  24-Hour Complete Rooftop Fitness Facility including Lap Pool, Sauna, yoga floor,   All just steps from Toronto's Financial Dist","CN Tower, TIFF Bell Lightbox, Metro Convention Centre, Princess of Wales Theatre, Rogers/ Air Canada Centre, Bell Lightbox, all within 1 minute walk. You will end up here during your visit to Toronto! Why not stay with us on location? You'll be glad you did. Welcome to 5***** Living - Bohemian decor~ in the Heartbeat of Toronto's ENTERTAINMENT DISTRICT at this Urban Hotel Alternative. Welcome to warm downtown Living - Chic 1 + 1 Bedroom Condo Luxuriously furnished with Contemporary stylings.  Step inside and you are a million miles from it all, step out and you could be in the middle of a shakespeare re-enactment.  Get the most the city has to offer as shopping, dining, sports and theater are all within walking distance.  Situated in the heart of Toronto's Entertainment district, this unique Condominium shares an intersection with the exclusive SOHO Met and features 775 sqft of artistic déco. leaving no amenity spared. Feel like Home with Salvador Dali and friends on your wall.   Enjoy",none,"There's a reason they call it the Entertainment District.  Restaurants of all kinds, nightlife, shopping, drop in for fitness or dance classes, walk to the theatre or ride up the CN Tower all within a 3 minute walk.  You have arrived!  Surrounded by boutique hotels you'll find locals and tourists alike in this fabulous, vibrant neighbourhood!",,"Walk everywhere! Transit at your doorstep, endless taxis around.",100% use of space and amenities,,No Smoking Parking Available on Request ($20 daily) please inquire Please Inquire for detailed reservation policies $300 security deposit,,,https://a0.muscache.com/im/pictures/81811785/5dcd6dd9_original.jpg?aki_policy=large,,113345,https://www.airbnb.com/users/show/113345,Adela,2010-04-25,"Toronto, Ontario, Canada","Welcome to Toronto! 

After our first meeting I hope i will have the opportunity to welcome you again!",within a few hours,80%,21%,f,https://a0.muscache.com/im/users/113345/profile_pic/1440562246/original.jpg?aki_policy=profile_small,https://a0.muscache.com/im/users/113345/profile_pic/1440562246/original.jpg?aki_policy=profile_x_medium,Entertainment District,7,7,"['email', 'phone', 'reviews', 'jumio', 'government_id', 'work_email']",t,t,"Toronto, ON, Canada",Downtown Toronto,Waterfront Communities-The Island,,Toronto,ON,M5V 3P5,Toronto,"Toronto, Canada",CA,Canada,43.6453,-79.3894,t,Condominium,Entire home/apt,5,1,1,2,Real Bed,"{TV,""Cable TV"",Internet,Wifi,""Air conditioning"",""Wheelchair accessible"",Pool,Kitchen,""Pets allowed"",Doorman,Gym,Elevator,Heating,""Family/kid friendly"",Washer,Dryer,""Smoke detector"",""Carbon monoxide detector"",""Fire extinguisher"",Essentials,Shampoo,""24-hour check-in"",Hangers,""Hair dryer"",Iron,""Laptop friendly workspace"",""Self check-in"",""Building staff"",""Private entrance"",""Hot water"",""Bed linens"",""Extra pillows and blankets"",Microwave,""Coffee maker"",Refrigerator,Dishwasher,""Dishes and silverware"",""Cooking basics"",Oven,Stove,""Single level home"",""Patio or balcony"",""Luggage dropoff allowed"",""Long term stays allowed"",""Paid parking on premises""}",,$199.00,,"$4,766.00",$300.00,$51.00,2,$18.00,4,730,4,5,730,730,4,730,a week ago,t,26,43,72,347,2020-03-16,39,3,2011-01-05,2020-01-06,95,10,10,9,10,10,9,f,,,f,f,strict_14_with_grace_period,f,f,5,5,0,0,0.35
42892,https://www.airbnb.com/rooms/42892,20200316134823,2020-03-16,"3 Beds: Modern High Floor next to CN Tower, Union","Modern and stylish 2 bedroom plus large den and 2 bathroom downtown luxurious condo on high floor with south lake view located at the Maple Leaf Square, next to Union subway station, CN Tower, harbour, and financial district.","Modern and stylish 2 bedroom plus large den, and 2 bathroom downtown luxurious condo located at the Maple Leaf Square, on very high floor– next to Scotiabank Arena Centre), with south lake view, and next to Union station.   Furnished Unit includes: 3 Beds Master bedroom with queen bed and second bedroom with double/full size bed and Large Den with double size bed and dresser, wardrobe) High speed wireless internet VIP cable, local phone calls with unlimited North American long distance, bedding/towels, ensuite laundry and fully equipped kitchen with pots/pans/dishware/utensils, and all utilities (hydro, electricity, water).  Amenities: Building has indoor swimming pool, hot tub, sauna, gym,  supermarket, liquor store, bank, and more.  Location: Next to Air Canada Centre, minutes walk to Union Station, fashion, entertainment, and financial districts, harbour front, supermarket (Loblaws and Sobeys), convenience store 24/7, and quick access to highway.  Parking can be rented for $220/mont","Modern and stylish 2 bedroom plus large den and 2 bathroom downtown luxurious condo on high floor with south lake view located at the Maple Leaf Square, next to Union subway station, CN Tower, harbour, and financial district. Modern and stylish 2 bedroom plus large den, and 2 bathroom downtown luxurious condo located at the Maple Leaf Square, on very high floor– next to Scotiabank Arena Centre), with south lake view, and next to Union station.   Furnished Unit includes: 3 Beds Master bedroom with queen bed and second bedroom with double/full size bed and Large Den with double size bed and dresser, wardrobe) High speed wireless internet VIP cable, local phone calls with unlimited North American long distance, bedding/towels, ensuite laundry and fully equipped kitchen with pots/pans/dishware/utensils, and all utilities (hydro, electricity, water).  Amenities: Building has indoor swimming pool, hot tub, sauna, gym,  supermarket, liquor store, bank, and more.  Location: Next to Air Canada ",none,"Downtown, Harbourfront, Financial District, Air Canada Centre, Rogers Centre, Ripleys Aquarium, St. Lawrence Market, Union station",,"Union subway, streetcar, buses","Building has indoor  swimming pool, hot tub, sauna, gym,  supermarket, liquor store, bank, and more.",,,,,https://a0.muscache.com/im/pictures/171a2320-de8f-428b-8ea8-e6a84f0e7e89.jpg?aki_policy=large,,187320,https://www.airbnb.com/users/show/187320,Downtown Suite Living,2010-08-01,"Toronto, Ontario, Canada","Hey there! Glad you decided to settle in. We are Alexander and Lily - we run a professional company called Downtown Suite Living that specializes in modern and stylish furnished accommodations for extended stays conveniently located in the heart of downtown Toronto. 

Our suites are fully furnished with standardized features and services to ensure your stay is as comfortable and enjoyable as possible: High speed wireless internet, VIP cable package, unlimited North American long distance, ensuite laundry, fully equipped kitchen with full size appliances, all utilities included, and access to amenities.
 
We look forward to having you stay in our downtown suites and to experience downtown living.  

Relax, You're Home! 

Thanks,
Alexander & Lily 
Downtown Suite Living Inc. 




",within a few hours,100%,84%,t,https://a0.muscache.com/im/users/187320/profile_pic/1444258888/original.jpg?aki_policy=profile_small,https://a0.muscache.com/im/users/187320/profile_pic/1444258888/original.jpg?aki_policy=profile_x_medium,Entertainment District,17,17,"['email', 'phone', 'reviews', 'jumio', 'government_id']",t,t,"Toronto, ON, Canada",Entertainment District,Waterfront Communities-The Island,,Toronto,ON,M5J 0A1,Toronto,"Toronto, Canada",CA,Canada,43.64451,-79.38185,t,Condominium,Entire home/apt,4,2,3,3,Real Bed,"{TV,""Cable TV"",Internet,Wifi,""Air conditioning"",Pool,Kitchen,Doorman,Gym,Elevator,""Hot tub"",Heating,""Family/kid friendly"",Washer,Dryer,""Smoke detector"",Essentials,Shampoo,Hangers,""Hair dryer"",Iron,""Laptop friendly workspace"",""Hot water"",""Long term stays allowed"",""Host greets you"",""Lake access"",""Paid parking on premises""}",750,$135.00,,"$3,600.00",$0.00,$150.00,1,$0.00,120,1125,120,120,1125,1125,120,1125,2 weeks ago,t,0,14,44,319,2020-03-16,0,0,,,,,,,,,,f,,,f,f,strict_14_with_grace_period,f,f,12,12,0,0,
45399,https://www.airbnb.com/rooms/45399,20200316134823,2020-03-16,Fountain View Studio - Eaton center,"Open Space studio style, Big windows, calm & relaxing view to a fountain and a nice park. Double glazed windows allow you to watch and enjoy the view with silence and warmth. fully equipped kitchen. Queen bed.","Large furnished bachelor ( 420 sq.ft ) located at Yonge & College . College subway station is accessible indoor from within the building. The complex is connected to a shopping mall where  banks, post office, 24-hour groceries (Metro) and food courts, etc. These amenities make this location very convenient and very secure with 24-hour security.  The apartment is newly renovated including bathroom and kitchen and hardwood floors throughout, and fully furnished with style. For your comfort, cable TV and wireless hi-speed internet are included.  Linens and towels are provided. The apartment is a 5-minute walk to the Eaton Center (largest shopping complex in Toronto), a few minutes' walk to the financial district and to Ryerson University. Also very close to College west, very trendy area with bars, lounges and restaurants.","Open Space studio style, Big windows, calm & relaxing view to a fountain and a nice park. Double glazed windows allow you to watch and enjoy the view with silence and warmth. fully equipped kitchen. Queen bed. Large furnished bachelor ( 420 sq.ft ) located at Yonge & College . College subway station is accessible indoor from within the building. The complex is connected to a shopping mall where  banks, post office, 24-hour groceries (Metro) and food courts, etc. These amenities make this location very convenient and very secure with 24-hour security.  The apartment is newly renovated including bathroom and kitchen and hardwood floors throughout, and fully furnished with style. For your comfort, cable TV and wireless hi-speed internet are included.  Linens and towels are provided. The apartment is a 5-minute walk to the Eaton Center (largest shopping complex in Toronto), a few minutes' walk to the financial district and to Ryerson University. Also very close to College west, very trendy",none,"Amazing neighbourhood, very central and walking distance to most of the city attractions. Shopping can be done within the building or 5 mts away from Eaton centre and the Bay on Dundas - Queen street.",Apartment is newly renovated and well / better cleaned as I changed the cleaning service I was dealing with after few complaints from couple of guests. and now I have new cleaners with new linens & towels..etcc..,"Getting around can't be easier, Metro station located indoor with a direct access from your building, Busses and street cars to go east and west of the cities are right out of your door.",Private access to guest to all the unit.,"I am usually available during guests stay to help or answer any questions or needs, or change something you don't like about the apartment..anything can make guests stay very comfortable.","No smoking inside the apartment, but allowed on the patio located on the same floor.  $40 extra charge after the second guest.",,,https://a0.muscache.com/im/pictures/5e2bfbce-c070-4597-a5ba-e7fb4ff8d9e4.jpg?aki_policy=large,,195095,https://www.airbnb.com/users/show/195095,Urbano,2010-08-08,"Toronto, Ontario, Canada","Boutique property management firm located in Toronto, specializing in furnished short term rentals in strategic locations throughout the city.",within an hour,100%,94%,f,https://a0.muscache.com/im/users/195095/profile_pic/1315086005/original.jpg?aki_policy=profile_small,https://a0.muscache.com/im/users/195095/profile_pic/1315086005/original.jpg?aki_policy=profile_x_medium,Rosedale,12,12,"['email', 'phone', 'reviews', 'jumio', 'government_id']",t,t,"Toronto, ON, Canada",Downtown Toronto,Church-Yonge Corridor,,Toronto,ON,M5B,Toronto,"Toronto, Canada",CA,Canada,43.65972,-79.38172,t,Condominium,Entire home/apt,3,1,0,1,Real Bed,"{TV,""Cable TV"",Internet,Wifi,""Air conditioning"",Kitchen,Gym,Elevator,Heating,Washer,Dryer,""Smoke detector"",""Carbon monoxide detector"",Essentials,Shampoo,""24-hour check-in"",Hangers,Iron,""Laptop friendly workspace"",""Hot water"",""Bed linens"",Microwave,Refrigerator,""Dishes and silverware"",""Luggage dropoff allowed"",""Long term stays allowed"",""Host greets you"",""Paid parking on premises""}",,$120.00,$680.00,,$0.00,$82.00,2,$65.00,1,365,1,1,365,365,1,365,a week ago,t,22,52,82,357,2020-03-16,78,13,2010-10-29,2019-11-07,83,9,8,9,9,10,8,f,,,f,f,strict_14_with_grace_period,f,f,12,9,3,0,0.68
51616,https://www.airbnb.com/rooms/51616,20200316134823,2020-03-16,Large room in trendy King Street West.,My place is near the trendy King St. West strip but still quiet. Walking distance to so many downtown spots.,"One bedroom in a 2 bedroom apartment on King Street West. Near the trendy King st. west strip, short walk to cool Queen St. west, 10 minute walk to Bell Lightbox (TIFF) and 25 minute walk to CN Tower.","My place is near the trendy King St. West strip but still quiet. Walking distance to so many downtown spots. One bedroom in a 2 bedroom apartment on King Street West. Near the trendy King st. west strip, short walk to cool Queen St. west, 10 minute walk to Bell Lightbox (TIFF) and 25 minute walk to CN Tower. Shared living/dining room. I can help guests get oriented in Toronto. Near the hopping King st west strip of restaurants, bars, lounges and clubs. Near two street-car lines.",none,"Near the hopping King st west strip of restaurants, bars, lounges and clubs.",,Near two street-car lines.,Shared living/dining room.,I can help guests get oriented in Toronto.,- No shoes inside. Please take off and place in hall closet. Keep things clean and tidy. No smoking indoors. Please be easy going and respectful.,,,https://a0.muscache.com/im/pictures/b2bd98d5-4d5b-4025-b10a-76dd81f13757.jpg?aki_policy=large,,237587,https://www.airbnb.com/users/show/237587,John,2010-09-17,"Toronto, Ontario, Canada",,within a day,100%,N/A,f,https://a0.muscache.com/im/users/237587/profile_pic/1444257310/original.jpg?aki_policy=profile_small,https://a0.muscache.com/im/users/237587/profile_pic/1444257310/original.jpg?aki_policy=profile_x_medium,Niagara,1,1,"['email', 'phone', 'reviews', 'jumio', 'government_id']",t,t,"Toronto, ON, Canada",Niagara,Niagara,,Toronto,ON,M5V 2W8,Toronto,"Toronto, Canada",CA,Canada,43.64296,-79.40451,t,Condominium,Private room,2,1,1,1,Real Bed,"{TV,Internet,Wifi,""Air conditioning"",Kitchen,""Paid parking off premises"",Elevator,""Indoor fireplace"",""Buzzer/wireless intercom"",Heating,Washer,""Smoke detector"",Essentials,Shampoo,""Lock on bedroom door"",Hangers,""Hair dryer"",Iron,""Laptop friendly workspace"",""translation missing: en.hosting_amenity_49"",""translation missing: en.hosting_amenity_50"",""Hot water"",Microwave,""Coffee maker"",Refrigerator,Dishwasher,""Dishes and silverware"",""Cooking basics"",Oven,Stove,""Single level home"",""Host greets you""}",,$55.00,,,$500.00,$25.00,1,$40.00,91,125,91,91,125,125,91,125,12 months ago,t,29,59,89,179,2020-03-16,24,0,2016-08-10,2018-11-11,98,10,10,10,10,10,10,f,,,f,f,strict_14_with_grace_period,f,f,1,0,1,0,0.55
57483,https://www.airbnb.com/rooms/57483,20200316134823,2020-03-16,"Downtown 3 Bed @ Union, Scotiabank Arena, CN Tower",Modern 2 bedrooms plus large large den  and 2 bathrooms downtown luxurious condo located at the Maple Leaf Square (York and Bremner – next to Scotiabank Arena Centre and Union station.,"Modern and stylish 2 bedroom plus large den and 2 bathroom downtown luxurious condo located on very high floor at the Maple Leaf Square– next to harbourfront, CN Tower, Scotiabank Arena, and Union station.  Furnished Unit includes:  Master bedroom with queen bed and second bedroom and large den with double/full size bed  High speed wireless internet VIP cable, local phone calls with unlimited North American long distance, bedding/towels, ensuite laundry and fully equipped kitchen with pots/pans/dishware/utensils, and all utilities (hydro, electricity, water). Amenities: Building has indoor  swimming pool, hot tub, sauna, gym,  supermarket, liquor store, bank, and more. Location: Next to Air  Centre, minutes walk to Union Station, fashion, entertainment, and financial districts, harbour front, supermarket (Loblaws and Sobeys), convenience store 24/7, and quick access to highway. Building has public paid daily parking for around $30/day.  Deposits: Key Deposit of $80 per each key set (ma","Modern 2 bedrooms plus large large den  and 2 bathrooms downtown luxurious condo located at the Maple Leaf Square (York and Bremner – next to Scotiabank Arena Centre and Union station. Modern and stylish 2 bedroom plus large den and 2 bathroom downtown luxurious condo located on very high floor at the Maple Leaf Square– next to harbourfront, CN Tower, Scotiabank Arena, and Union station.  Furnished Unit includes:  Master bedroom with queen bed and second bedroom and large den with double/full size bed  High speed wireless internet VIP cable, local phone calls with unlimited North American long distance, bedding/towels, ensuite laundry and fully equipped kitchen with pots/pans/dishware/utensils, and all utilities (hydro, electricity, water). Amenities: Building has indoor  swimming pool, hot tub, sauna, gym,  supermarket, liquor store, bank, and more. Location: Next to Air  Centre, minutes walk to Union Station, fashion, entertainment, and financial districts, harbour front, supermarket",none,,,,,,Deposits: Key Deposit of $80 for each set (maximum 3 set) No smoking inside unit and common areas.  No pets allowed.,,,https://a0.muscache.com/im/pictures/f6a32f54-f0f3-4f10-a4f6-85c2e88f7c7a.jpg?aki_policy=large,,187320,https://www.airbnb.com/users/show/187320,Downtown Suite Living,2010-08-01,"Toronto, Ontario, Canada","Hey there! Glad you decided to settle in. We are Alexander and Lily - we run a professional company called Downtown Suite Living that specializes in modern and stylish furnished accommodations for extended stays conveniently located in the heart of downtown Toronto. 

Our suites are fully furnished with standardized features and services to ensure your stay is as comfortable and enjoyable as possible: High speed wireless internet, VIP cable package, unlimited North American long distance, ensuite laundry, fully equipped kitchen with full size appliances, all utilities included, and access to amenities.
 
We look forward to having you stay in our downtown suites and to experience downtown living.  

Relax, You're Home! 

Thanks,
Alexander & Lily 
Downtown Suite Living Inc. 




",within a few hours,100%,84%,t,https://a0.muscache.com/im/users/187320/profile_pic/1444258888/original.jpg?aki_policy=profile_small,https://a0.muscache.com/im/users/187320/profile_pic/1444258888/original.jpg?aki_policy=profile_x_medium,Entertainment District,17,17,"['email', 'phone', 'reviews', 'jumio', 'government_id']",t,t,"Toronto, ON, Canada",Entertainment District,Waterfront Communities-The Island,,Toronto,ON,M5J 0A7,Toronto,"Toronto, Canada",CA,Canada,43.64214,-79.37994,t,Condominium,Entire home/apt,4,2,3,3,Real Bed,"{TV,""Cable TV"",Internet,Wifi,""Air conditioning"",Pool,Kitchen,Doorman,Gym,Elevator,""Hot tub"",Heating,""Family/kid friendly"",Washer,Dryer,""Smoke detector"",""Carbon monoxide detector"",Essentials,Shampoo,Hangers,""Hair dryer"",Iron,""Laptop friendly workspace"",""Hot water"",""Bed linens"",""Extra pillows and blankets"",Microwave,""Coffee maker"",Refrigerator,Dishwasher,""Dishes and silverware"",""Cooking basics"",Oven,Stove,""Patio or balcony"",""Long term stays allowed"",""Host greets you"",""Lake access"",""Paid parking on premises""}",,$175.00,,"$3,800.00",$0.00,$150.00,1,$0.00,118,365,118,118,365,365,118,365,2 weeks ago,t,0,14,44,134,2020-03-16,0,0,,,,,,,,,,f,,,f,f,strict_14_with_grace_period,f,f,12,12,0,0,
