69464,https://www.airbnb.com/rooms/69464,20200316134823,2020-03-16,Yonge & Bloor one bedroom Condo,"Large 1 bedroom condo, perfect layout with a walk-in balcony. The space is amazing for two people or solo adventure. Has everything you need to make your stay very comfortable including - Fridge, oven, Microwave,washer & dryer,dishwasher, Iron & board -Air-conditioning & heating 24 hours as needed.  -nice lighting system with dimmers all over the place. -newly renovated - Comfy Sofa with extra linens suitable for a night or two for an extra guest.","Fully Furnished 1-bedroom condo ( 700 sq.ft ) located on Yonge & Bloor on the 14th floor. The condo apartment is newly renovated and furnished with a style, full kitchen supplies with en-suite laundry and brand new appliances including microwave, dishwasher, washer and dryer, fridge and stove. The building is less than 1 minute Yonge and Bloor subway station and across the street from an underground complex to all shopping malls with designers boutiques, food courts, banks and 24-hour grocery store. Steps from University of Toronto, Yorkville Area and also few minutes walking to Ryerson University campus and to the Eaton center, largest mall in DT Toronto. This condo is located in a prime location and perfect for visitors as it’s well centered. This is an all-inclusive condo rental, Rent includes All utilities, Cable TV, wireless hi-speed internet, fully equipped fitness gym, Sauna and steam room, Roof terrace Patio and BBQ with a great view of the city to the lake. Condo comes with a ","Large 1 bedroom condo, perfect layout with a walk-in balcony. The space is amazing for two people or solo adventure. Has everything you need to make your stay very comfortable including - Fridge, oven, Microwave,washer & dryer,dishwasher, Iron & board -Air-conditioning & heating 24 hours as needed.  -nice lighting system with dimmers all over the place. -newly renovated - Comfy Sofa with extra linens suitable for a night or two for an extra guest. Fully Furnished 1-bedroom condo ( 700 sq.ft ) located on Yonge & Bloor on the 14th floor. The condo apartment is newly renovated and furnished with a style, full kitchen supplies with en-suite laundry and brand new appliances including microwave, dishwasher, washer and dryer, fridge and stove. The building is less than 1 minute Yonge and Bloor subway station and across the street from an underground complex to all shopping malls with designers boutiques, food courts, banks and 24-hour grocery store. Steps from University of Toronto, Yorkville",none,"The place is located at yonge & bloor, one of Toronto's most centered iconic intersection. walking distance to most city attractions such as the ROM museum, Yorkville area, the village on church street, bloor west trendy area, university of Toronto. Steps to many cafes, restaurants and night pubs just few steps away. 24 h groceries, banks, fitness gym, pharmacies and post office, food courts, many boutiques and many mores just across the street. This area is a busy and well mixed between visitors & professionals and once you are back to the apartment it is very calm due to the double glass windows for a total relaxing afternoon or evening. Very safe, busy and convenient, up scaled neighborhood full of entertainment just out of your door.",,"Getting around from this location can't be easier. Night busses across the street. subway is across the street. and walking distance to anything you want .  10-15 minutes walk to Eaton center, dundas square.  10 minutes walk to college street to access college west neighborhood  15 minutes walk to Queen and king west an amazing area for visitors. 20 minutes walk to the CN tower and front street to the lake and water front.",Guests will have the whole condo for themselves with full access to use and enjoy whatever this amazing space has to offer with list of amenities.,The host will be 24/7 available for the guest to help them and assist them especially for first timers in Toronto. I am very familiar with my area and will suggest and advice my guests with best choices to make for a perfect vacation to spend to make sure you get the best choices in anything you want. I am always available for helping my guests in check in and out.,No Smoking No pets  $150 refundable deposit is needed,,,https://a0.muscache.com/im/pictures/16331207/27208643_original.jpg?aki_policy=large,,195095,https://www.airbnb.com/users/show/195095,Urbano,2010-08-08,"Toronto, Ontario, Canada","Boutique property management firm located in Toronto, specializing in furnished short term rentals in strategic locations throughout the city.",within an hour,100%,94%,f,https://a0.muscache.com/im/users/195095/profile_pic/1315086005/original.jpg?aki_policy=profile_small,https://a0.muscache.com/im/users/195095/profile_pic/1315086005/original.jpg?aki_policy=profile_x_medium,Rosedale,12,12,"['email', 'phone', 'reviews', 'jumio', 'government_id']",t,t,"Toronto, ON, Canada",Rosedale,Rosedale-Moore Park,,Toronto,ON,M4W 3T3,Toronto,"Toronto, Canada",CA,Canada,43.67094,-79.38581,t,Condominium,Entire home/apt,3,1,1,1,Real Bed,"{TV,""Cable TV"",Internet,Wifi,""Air conditioning"",Kitchen,""Paid parking off premises"",Gym,Elevator,""Hot tub"",""Buzzer/wireless intercom"",Heating,""Family/kid friendly"",Washer,Dryer,""Smoke detector"",""Carbon monoxide detector"",Essentials,Shampoo,""24-hour check-in"",Hangers,""Hair dryer"",Iron,""Laptop friendly workspace"",""High chair"",""Hot water"",Microwave,""Coffee maker"",Refrigerator,""Dishes and silverware"",""Cooking basics"",""Patio or balcony"",""Long term stays allowed"",""Host greets you""}",,$120.00,$780.00,"$2,850.00",$0.00,$65.00,2,$70.00,1,365,1,1,365,365,1,365,3 days ago,t,28,34,50,305,2020-03-16,47,10,2011-02-07,2020-01-03,91,9,9,10,10,10,9,f,,,t,f,strict_14_with_grace_period,f,f,12,9,3,0,0.42
84076,https://www.airbnb.com/rooms/84076,20200316134823,2020-03-16,A short walk to TIFF,"Right in the core of Toronto at King & Bathurst Easy to explore the city by foot or transit.  Close to : Liberty Village, Kensington Market, Little Italy, Chinatown, downtown, Lake Ontario, Rogers Centre shops, convenience stores, drug store, dry cleaning, restaurants, pubs, photocopying all in a block radius.  Amazing amenities (pool, gym, hot tub, theatre, store, laundry, courtyard) Best for 1 person but can host up to 3 Parking - there is a lot on the side street (paid but affordable)","New upgrades! Floors (2 years old) Blinds (1 Year old) Mattress brand new! Amazing location right in the heart of Toronto at King & Bathurst making it easy to explore the city by foot or transit.  Transit is right at the corner. Going in all directions. Many cases faster to walk if you are staying downtown. The lake, Queen Street, Kensington Market, entertainment district and Trinity Bellwoods Park are a quick walk or bike ride away. The condo has a great view as it is on the 17th floor, a fireplace and is roughly 850 square feet. Great for 1 person or couple. There is a couch if another person is staying. (or bring a blow up mattress) The condo has a full kitchen with a microwave, dishwasher, toaster oven, oven, fridge, etc. There is wireless internet, plus a table (dining table but can be used as a work area) Act fast as this is sure to go quickly at the price being offered. If you're interested or have any questions please feel free to give me a shout.","Right in the core of Toronto at King & Bathurst Easy to explore the city by foot or transit.  Close to : Liberty Village, Kensington Market, Little Italy, Chinatown, downtown, Lake Ontario, Rogers Centre shops, convenience stores, drug store, dry cleaning, restaurants, pubs, photocopying all in a block radius.  Amazing amenities (pool, gym, hot tub, theatre, store, laundry, courtyard) Best for 1 person but can host up to 3 Parking - there is a lot on the side street (paid but affordable) New upgrades! Floors (2 years old) Blinds (1 Year old) Mattress brand new! Amazing location right in the heart of Toronto at King & Bathurst making it easy to explore the city by foot or transit.  Transit is right at the corner. Going in all directions. Many cases faster to walk if you are staying downtown. The lake, Queen Street, Kensington Market, entertainment district and Trinity Bellwoods Park are a quick walk or bike ride away. The condo has a great view as it is on the 17th floor, a fireplace an",none,"Tons of pubs, restaurants, clubs all within 5-15 minutes walking distance including Subway, McDonalds, Pizza Hut, Pita Pit, Wine Rack, Sushi, Coco Rice (Thai), Starbucks, Shoppers Drugmart, Dry Cleaning, Dollarama  and many many more including the Toronto's oldest pub the Wheatsheaf - just within minutes. It truly is everything you need at the doorstep. Just 10 - 15 min walk to Queen St.  The King Street Entertainment district is just minutes away. Also easy access to Lakeshore.","If coming in the summer months - the back courtyard is amazing. No other building in the city has one like it. Pool, picnic area, BBQ's, children's play area.","Transit is just out the door going in every direction - streetcars are frequent, rarely have to wait long.",Building has amazing amenities including: • indoor/outdoor pool • outdoor courtyard / BBQ area / picnic tables • hot tub / sauna • gym / squash courts • theatre - yes they show movies daily. • convenience store • coin laundry,I check in from time to time through email / text / phone to make sure everything is going well. I usually rent when I myself am travelling so I won't be in the city but I have a friend look in on the place and is available.,Suitable for a single person - a couple is fine also but a small extra cost. NO SMOKING NO PARTIES Please be courteous to the neighbours (noise) Water the plants once a week Please leave the place as you found it. I am pretty easy going as long as you respect my place and belongings.,,,https://a0.muscache.com/im/pictures/575131/d541b861_original.jpg?aki_policy=large,,544254,https://www.airbnb.com/users/show/544254,Darryl,2011-04-29,"Toronto, Ontario, Canada","I live and work downtown - I freelance in the graphics business (my clients include Live Nation, Gibson Guitars, Humber College), I also book bands and run music festivals.

Due to my busy schedule I rarely am home and found Air BnB a good way to make use of my space while I'm not around.",N/A,N/A,N/A,f,https://a0.muscache.com/im/users/544254/profile_pic/1404260984/original.jpg?aki_policy=profile_small,https://a0.muscache.com/im/users/544254/profile_pic/1404260984/original.jpg?aki_policy=profile_x_medium,Niagara,1,1,"['email', 'phone', 'reviews', 'jumio', 'offline_government_id', 'government_id', 'work_email']",t,f,"Toronto, ON, Canada",Niagara,Niagara,,Toronto,ON,,Toronto,"Toronto, Canada",CA,Canada,43.64457,-79.40451,t,Condominium,Entire home/apt,2,1,1,1,Real Bed,"{TV,Internet,Wifi,""Air conditioning"",""Wheelchair accessible"",Pool,Kitchen,""Paid parking off premises"",Doorman,Gym,""Hot tub"",""Indoor fireplace"",""Buzzer/wireless intercom"",Heating,""Family/kid friendly"",Washer,Dryer,""Smoke detector"",""Carbon monoxide detector"",Essentials,Shampoo,Hangers,""Laptop friendly workspace"",""Hot water"",Microwave,Refrigerator,Dishwasher,""Dishes and silverware"",""Cooking basics"",Oven,Stove,""Garden or backyard"",Other}",850,$145.00,$720.00,"$2,268.00",$500.00,$75.00,1,$35.00,3,60,3,3,60,60,3,60,15 months ago,t,0,0,0,0,2020-03-16,6,0,2013-09-09,2018-08-20,87,9,7,10,10,10,8,f,,,t,f,strict_14_with_grace_period,f,f,1,1,0,0,0.08
113175,https://www.airbnb.com/rooms/113175,20200316134823,2020-03-16,Best luxury location in downtown Toronto!,,"Luxury & Best location in Toronto! NOTE: SUITE ONLY AVAILABLE FOR LONG TERM STAY. THANK YOU My apartment is all around amazing! It is fully furnished and the location is fantastic because it's in the heart of downtown, in the financial district, right on the streetcar line, next to Harbourfront and 10 minutes to anywhere downtown! It's a 1 bedroom apartment with a separate living room and kitchen area that you can entertain or relax in. The bathroom is well-sized and the entire place is about 562 sq. feet of pure luxury! There's a queen size bed in the bedroom and an inflatable queen size mattress that can be pulled out from my closet if there are two extra guests that want to bunk in comfort in the living room. The apartment has a washer/dryer, dishwasher, stove, microwave, refrigerator, dishes, cooking pots, cutlery, towels, etc - fully stocked apartment.  The building is fairly new and has amazing amenities, including a gym, pool, bbq terrace, steam room, hot tub/jacuzzi, pool table","Luxury & Best location in Toronto! NOTE: SUITE ONLY AVAILABLE FOR LONG TERM STAY. THANK YOU My apartment is all around amazing! It is fully furnished and the location is fantastic because it's in the heart of downtown, in the financial district, right on the streetcar line, next to Harbourfront and 10 minutes to anywhere downtown! It's a 1 bedroom apartment with a separate living room and kitchen area that you can entertain or relax in. The bathroom is well-sized and the entire place is about 562 sq. feet of pure luxury! There's a queen size bed in the bedroom and an inflatable queen size mattress that can be pulled out from my closet if there are two extra guests that want to bunk in comfort in the living room. The apartment has a washer/dryer, dishwasher, stove, microwave, refrigerator, dishes, cooking pots, cutlery, towels, etc - fully stocked apartment.  The building is fairly new and has amazing amenities, including a gym, pool, bbq terrace, steam room, hot tub/jacuzzi, pool table",none,,"RECOMMENDATIONS FOR TORONTO: A FUN GUIDE FROM ME BRUNCH: •Le Neuf – close-by (less than 5-min walk) French brunch spot with (Website hidden by Airbnb) relaxed Parisian décor and great food. •Lady Marmalade – They’re kind of a Toronto institution for brunch. No (Website hidden by Airbnb) reservations accepted so you’ll have to wait in line for 30-45 minutes (Website hidden by Airbnb) for a table on weekends, but their food can’t be beat. Definitely worth (Website hidden by Airbnb) the wait! MY FAV RESTAURANTS IN TORONTO: •Italian: Campagnolo, Enoteca Sociale, Terroni, Pizzeria Libretto •Spanish/Mexican: Grand Electric, La Carnita, Patria •Tapas: Bar Isabel, Cluny •Thai: Pai, Khoa San Road, Sukhothai •Korean: OddSeoul •Best/Favourite local restaurant: The Atlantic (all organic, local (Website hidden by Airbnb) ingredients fresh from the market and every meal is different based on (Website hidden by Airbnb) day and time you go there. The chef is incredible and it’s pay what you (Website h",The condo is directly across from 24 hour streetcar line for easy access.,Everything,,"No smoking or loud noise allowed on the premises.  Please remove shoes in the front hallway and leave them there, as guests after you have related dust and other allergies.",,,https://a0.muscache.com/im/pictures/775624/973bf83f_original.jpg?aki_policy=large,,576192,https://www.airbnb.com/users/show/576192,Faria,2011-05-10,"Toronto, Ontario, Canada",I work in the US so looking for people who'd like to rent out my place for short or longer stays :),within a few hours,100%,86%,t,https://a0.muscache.com/im/pictures/user/f05c97f0-e117-4b21-8e1d-fc8db1775e90.jpg?aki_policy=profile_small,https://a0.muscache.com/im/pictures/user/f05c97f0-e117-4b21-8e1d-fc8db1775e90.jpg?aki_policy=profile_x_medium,Downtown Toronto,1,1,"['email', 'phone', 'facebook', 'reviews', 'jumio', 'government_id', 'work_email']",t,t,"Toronto, ON, Canada",Downtown Toronto,Waterfront Communities-The Island,,Toronto,ON,M5V 3Z1,Toronto,"Toronto, Canada",CA,Canada,43.64123,-79.39339,t,Condominium,Entire home/apt,2,1,1,0,Real Bed,"{TV,Internet,Wifi,""Air conditioning"",Pool,Kitchen,""Paid parking off premises"",Gym,Elevator,""Hot tub"",""Indoor fireplace"",Heating,Washer,Dryer,""Smoke detector"",Essentials,Shampoo,Hangers,""Hair dryer"",Iron,""Laptop friendly workspace"",""translation missing: en.hosting_amenity_49"",""translation missing: en.hosting_amenity_50"",""Hot water"",Microwave,Refrigerator,""Dishes and silverware"",""Patio or balcony"",""Long term stays allowed"",Other,""Paid parking on premises""}",,$105.00,$625.00,"$1,850.00",$200.00,$150.00,2,$0.00,28,1000,25,28,1000,1000,25.6,1000,8 months ago,t,0,20,35,262,2020-03-16,35,4,2011-05-25,2020-01-18,91,9,9,9,9,10,10,f,,,f,f,strict_14_with_grace_period,f,f,1,1,0,0,0.33
131401,https://www.airbnb.com/rooms/131401,20200316134823,2020-03-16,WATERFRONT LUXURY SUITE - DOWNTOWN,"NOTE: Thank you for your interest in the suite. Please review house rules below. Prices are as advertised and non-negotiable. Suite is available for long term stay only. Suitable for business travelers and individuals. All viewings, communication, booking, and payments are processed online through Airbnb. Some furniture depicted in pictures may have been rearranged or no longer available.","WATERFRONT LUXURY SUITE- DOWNTOWN TORONTO Newly built, furnished luxury suite with high ceilings and modern amenities located centrally on waterfront. Suite has one bedroom and separate living area. And a stainless steel designer kitchen. Also, an over-sized balcony to enjoy breath taking view of lake and city.  The surrounding community gets an ""A"" in Walk-ability Score. Great for strolls to nearby scenic parks and music gardens by the water, waterfront festivals, or authentic restaurants!  Building amenities include: rooftop garden/terrace with amazing view of downtown, fitness centre, and round the clock security.  Easily accessible through streetcar line located across the street from the building. It is five minutes away from Union Station- connection for subway, GO bus & train, Via Rail, and to Greyhound bus station.  It is two minutes away from Toronto Island Airport YTZ, connecting many Canadian and U.S cities. And Toronto Pearson International Airport YYZ is about 25 minutes a","NOTE: Thank you for your interest in the suite. Please review house rules below. Prices are as advertised and non-negotiable. Suite is available for long term stay only. Suitable for business travelers and individuals. All viewings, communication, booking, and payments are processed online through Airbnb. Some furniture depicted in pictures may have been rearranged or no longer available. WATERFRONT LUXURY SUITE- DOWNTOWN TORONTO Newly built, furnished luxury suite with high ceilings and modern amenities located centrally on waterfront. Suite has one bedroom and separate living area. And a stainless steel designer kitchen. Also, an over-sized balcony to enjoy breath taking view of lake and city.  The surrounding community gets an ""A"" in Walk-ability Score. Great for strolls to nearby scenic parks and music gardens by the water, waterfront festivals, or authentic restaurants!  Building amenities include: rooftop garden/terrace with amazing view of downtown, fitness centre, and round the",none,,,,,,"The suite is in excellent condition, we would like you and future guests to enjoy your stay and return the suite as it was handed to you. If you have any questions in regards to your reservation, please feel free to contact us. Thank you ______ Guest agrees to review and initial each line item in this document, fill-in required information, sign, and provide required identification documents to complete security clearance and reservation process with 48 hours receipt of this document. ______ Primary guest agrees to forward for each guest an electronic color copy of their valid driver’s license (both front and back for U.S and Canadian guests) or color copy of valid passport photograph page and valid Canadian Visa (for international guests).  ______ Primary guest agrees to forward for each additional guest a separate signed copy of this agreement. ______ Primary guest agrees use of premises is exclusively for paid guest(s) making the reservation. ______ Primary guest agrees that a fine ",,,https://a0.muscache.com/im/pictures/108233700/8ddd335f_original.jpg?aki_policy=large,,604233,https://www.airbnb.com/users/show/604233,WaterfrontExecSuites,2011-05-19,"Toronto, Ontario, Canada",Luxury Accommodations: Please contact us regarding reservations.,within an hour,100%,33%,f,https://a0.muscache.com/im/users/604233/profile_pic/1364274928/original.jpg?aki_policy=profile_small,https://a0.muscache.com/im/users/604233/profile_pic/1364274928/original.jpg?aki_policy=profile_x_medium,Niagara,2,2,"['email', 'phone', 'reviews', 'jumio', 'offline_government_id', 'government_id']",t,t,"Toronto, ON, Canada",Niagara,Niagara,,Toronto,ON,M5V 0G8,Toronto,"Toronto, Canada",CA,Canada,43.63743,-79.40104,t,Condominium,Entire home/apt,2,1,1,1,Real Bed,"{TV,Internet,Wifi,""Air conditioning"",Kitchen,""Paid parking off premises"",Gym,Elevator,Heating,Washer,Dryer,""Smoke detector"",""Carbon monoxide detector"",Essentials,Hangers,""Hair dryer"",Iron,""Laptop friendly workspace"",""translation missing: en.hosting_amenity_49"",""translation missing: en.hosting_amenity_50"",""Hot water"",""Bed linens"",""Ethernet connection"",Microwave,""Coffee maker"",Refrigerator,Dishwasher,""Dishes and silverware"",""Cooking basics"",Oven,Stove,""Patio or balcony"",""Long term stays allowed"",Other,Waterfront,""Lake access""}",550,$70.00,$579.00,"$2,199.00",$500.00,$0.00,1,$7.00,175,367,175,175,367,367,175,367,11 months ago,t,0,0,0,196,2020-03-16,6,1,2015-07-02,2020-01-31,92,9,8,9,8,10,9,f,,,f,f,strict_14_with_grace_period,f,f,1,1,0,0,0.1
