579918,https://www.airbnb.com/rooms/579918,20200316134823,2020-03-16,Luxury Queen West Private Loft,This prime Queen West loft overlooks the lake and is the perfect spot for your stay in Toronto.,"This sun soaked south west facing corner loft overlooks Lake Ontario and is merely steps away from bustling West Queen West! Enjoy your own private space with a fully equipped kitchen, solarium and access to some of Toronto's finest shops, bars and restaurants. You'll love the rustic exposed concrete and exposed ducting and chic decorating in the entire unit.  Situated just south of the historic Drake Hotel, enjoy condo amenities such as a pool, gym and in unit temperature control. Considered one of the hippest areas in Toronto, West Queen West is smack dab in the middle of all things cultural. Ossington Avenue boasts world class restaurants and bars just a stone throw away. Downtown is only 15 minutes by 24 hour streetcar transit, and the subway line is easily reached by a 24 hour bus. Free visitor's parking is also available in the P1 parking garage. The loft is fully furnished with a double bed in the master bedroom, and a Serta double pull out bed in the living room. An in-unit was","This prime Queen West loft overlooks the lake and is the perfect spot for your stay in Toronto. This sun soaked south west facing corner loft overlooks Lake Ontario and is merely steps away from bustling West Queen West! Enjoy your own private space with a fully equipped kitchen, solarium and access to some of Toronto's finest shops, bars and restaurants. You'll love the rustic exposed concrete and exposed ducting and chic decorating in the entire unit.  Situated just south of the historic Drake Hotel, enjoy condo amenities such as a pool, gym and in unit temperature control. Considered one of the hippest areas in Toronto, West Queen West is smack dab in the middle of all things cultural. Ossington Avenue boasts world class restaurants and bars just a stone throw away. Downtown is only 15 minutes by 24 hour streetcar transit, and the subway line is easily reached by a 24 hour bus. Free visitor's parking is also available in the P1 parking garage. The loft is fully furnished with a doub",none,,,"It's super easy to get around my neighbourhood. There are two 24-hour streetcars (the 501 Queen car and 504 King car) going east/west and the 29 Dufferin Bus that goes north to Bloor where the subway is. If you need to go to the subway, make sure to take a paper transfer from the driver when you pay your fare ($3.25 cash).  There is a Bixi bike share program available at the corner of Queen and Ossington, a few blocks east of my place. It's only $5/day and in the summer is a great way to see the city.  Free visitor parking is available, but please let me know if you need it and I will give you further instructions on how to use the automated parking pass system. Warning, my parking garage fills up quickly on weekends, so make sure you park early! Several paid Green P parking lots are also close by. Cabbing from Pearson airport with no traffic should take about 35 minutes, and is about $60. You can take TTC (public transit) for $3.25, and will take just about an hour.  A cab ride from B","You have access to the building's pool and gym. Inside my place, you may use my record player and records (but please be nice to them) along with all cooking supplies. Coffee and tea are provided as well.","I usually like to greet my guests when they arrive, but sometimes it's necessary for the keys to be handed to you via a friend or lock box.","This is my home and I'm happy to share it with those who respect this. Some basic rules and common sense apply: Respect that there are neighbours (who aren't on holiday) - so no parties and excessive noise that will get me in hot water and wreck things for everyone else. I ask too that you take care of the place, treat it as you would your (Website hidden by Airbnb) clean up after you make a mess and don't smoke inside. There is a vacuum, and other cleaning supplies in case something happens. A bunch of my stuff (books, records, etc.) will be available for your use. Please make sure you put it back when you've finished enjoying it, and that you don't accidentally take it home. This will come out of your security deposit.",,,https://a0.muscache.com/im/pictures/1022a287-7d8c-4b03-a149-dab2fcab9c46.jpg?aki_policy=large,,1160065,https://www.airbnb.com/users/show/1160065,Vee,2011-09-14,"Toronto, Ontario, Canada","I'm a young professional, working at an amazing tech startup. In my spare time, I enjoy riding my bike, leather working and cooking. Whenever I can, I also love to travel. 

What I love most about travelling is the ""new city feel"" you get when you set foot in a place you've never been before. I prefer to walk and explore, and although I'm a list builder and planner, spontaneous meetings with new friends is amongst some of my favourite things.


",N/A,N/A,50%,f,https://a0.muscache.com/im/pictures/user/7ca40013-7975-489d-91d3-e3c88e9db508.jpg?aki_policy=profile_small,https://a0.muscache.com/im/pictures/user/7ca40013-7975-489d-91d3-e3c88e9db508.jpg?aki_policy=profile_x_medium,Niagara,1,1,"['email', 'phone', 'facebook', 'reviews', 'jumio', 'government_id']",t,t,"Toronto, ON, Canada",Niagara,Niagara,,Toronto,ON,M6J 3S7,Toronto,"Toronto, Canada",CA,Canada,43.63803,-79.41904,t,Condominium,Entire home/apt,2,1,2,1,Real Bed,"{Internet,Wifi,""Air conditioning"",""Wheelchair accessible"",Pool,Kitchen,""Free parking on premises"",""Paid parking off premises"",Gym,Elevator,""Buzzer/wireless intercom"",Heating,""Family/kid friendly"",Washer,Dryer,""Smoke detector"",""Carbon monoxide detector"",""First aid kit"",""Safety card"",""Fire extinguisher"",Essentials,Shampoo,Hangers,""Hair dryer"",Iron,""Self check-in"",Lockbox,""Hot water"",""Bed linens"",""Extra pillows and blankets"",Microwave,""Coffee maker"",Refrigerator,Dishwasher,""Dishes and silverware"",""Cooking basics"",Oven,Stove,""Patio or balcony"",""Luggage dropoff allowed""}",,$130.00,$800.00,"$2,000.00",$200.00,$30.00,2,$20.00,3,30,3,3,30,30,3,30,a week ago,t,0,6,11,11,2020-03-16,13,1,2012-09-03,2019-08-28,97,10,9,9,10,9,10,f,,,f,f,strict_14_with_grace_period,t,t,1,1,0,0,0.14
638586,https://www.airbnb.com/rooms/638586,20200316134823,2020-03-16,Toronto Downtown near TIFF &  Convention Centre,,"Kitchen, bedroom, bathroom, living room, utilities, TV with DVD player and cable TV, washer & dryer, pool, fitness facilities, roof patio facing the CN Tower. This condominium is located in the Heart of Downtown Toronto near to the CN Tower, Rogers Centre, 3 minutes walk to the Metro Convetion Centre and 5 minutes walk to TIFF. It is in the same block of Toronto International Film Festival building, (where all the Celebs from Hollywood & Bollywood are expected to gather under one roof), CBC Building and a block away or 5 mins walk to All the major Live Theatres conducting all the Broadway Shows, Opera, Concerts etc. including The Four Seasons Centre. NO SMOKING, PARTIES AND GATHERING ALLOWED.","Kitchen, bedroom, bathroom, living room, utilities, TV with DVD player and cable TV, washer & dryer, pool, fitness facilities, roof patio facing the CN Tower. This condominium is located in the Heart of Downtown Toronto near to the CN Tower, Rogers Centre, 3 minutes walk to the Metro Convetion Centre and 5 minutes walk to TIFF. It is in the same block of Toronto International Film Festival building, (where all the Celebs from Hollywood & Bollywood are expected to gather under one roof), CBC Building and a block away or 5 mins walk to All the major Live Theatres conducting all the Broadway Shows, Opera, Concerts etc. including The Four Seasons Centre. NO SMOKING, PARTIES AND GATHERING ALLOWED.",none,,,,,,,,,https://a0.muscache.com/im/pictures/8211694/84f3ed17_original.jpg?aki_policy=large,,3186285,https://www.airbnb.com/users/show/3186285,Solange,2012-08-07,"Toronto, Ontario, Canada","I'm excited to discover new places and meet new people!


Solange",N/A,N/A,100%,f,https://a0.muscache.com/im/users/3186285/profile_pic/1424556916/original.jpg?aki_policy=profile_small,https://a0.muscache.com/im/users/3186285/profile_pic/1424556916/original.jpg?aki_policy=profile_x_medium,Entertainment District,1,1,"['email', 'phone', 'reviews', 'selfie']",t,f,"Toronto, ON, Canada",Downtown Toronto,Waterfront Communities-The Island,,Toronto,ON,M5V 3A4,Toronto,"Toronto, Canada",CA,Canada,43.64271,-79.39244,t,Condominium,Entire home/apt,2,1,1,1,Real Bed,"{TV,""Cable TV"",Internet,Wifi,""Air conditioning"",""Wheelchair accessible"",Pool,Kitchen,Doorman,Gym,Elevator,""Hot tub"",""Buzzer/wireless intercom"",Heating,Washer,Dryer,""Smoke detector"",Essentials,Hangers,""Hair dryer"",Iron,""Hot water"",""Bed linens"",""Extra pillows and blankets"",Other}",0,$179.00,,"$3,000.00",$180.00,$0.00,1,$0.00,10,15,10,10,15,15,10,15,3 months ago,t,29,59,89,364,2020-03-16,61,1,2014-08-05,2019-04-07,94,10,9,9,10,10,9,f,,,f,f,flexible,f,f,1,1,0,0,0.89
682099,https://www.airbnb.com/rooms/682099,20200316134823,2020-03-16,Art lovers dream in Queen West,"SHARED ACCOMMODATION with well-travelled owner. Guest room's twin beds allow for maximum flexibility. Great for friends, parent with a child or couples that just want to take advantage of the location in a super clean space.","THE APARTMENT Location. Location. Location! Located in a historic conversion that was once the stables of the Grange Estate, this 1000 sq ft, 2 bedroom apartment has both style and location going for it. This light-filled garden apartment is open concept with hardwood floors, an exposed brick wall and art adorning the walls. The apartment features: • 1000 sq ft of living space with south- and west-facing views of downtown Toronto including the CN Tower, the Art Gallery of Ontario, the Ontario College of Art and Design and a beautiful tree-lined park • Shared bathroom, kitchen and living room with very neat, well travelled owner  • Clean-lined and modern furnishings • A spacious, open-plan kitchen • Free wi-fi access • A smoke and pet-free environment THE ROOM Your private room has comfortable twin beds.  Partial use of the closet allow guests to settle in and organize their belongings and feel right at home.  In-room air conditioner and baseboard heating allow guests to control tempera","SHARED ACCOMMODATION with well-travelled owner. Guest room's twin beds allow for maximum flexibility. Great for friends, parent with a child or couples that just want to take advantage of the location in a super clean space. THE APARTMENT Location. Location. Location! Located in a historic conversion that was once the stables of the Grange Estate, this 1000 sq ft, 2 bedroom apartment has both style and location going for it. This light-filled garden apartment is open concept with hardwood floors, an exposed brick wall and art adorning the walls. The apartment features: • 1000 sq ft of living space with south- and west-facing views of downtown Toronto including the CN Tower, the Art Gallery of Ontario, the Ontario College of Art and Design and a beautiful tree-lined park • Shared bathroom, kitchen and living room with very neat, well travelled owner  • Clean-lined and modern furnishings • A spacious, open-plan kitchen • Free wi-fi access • A smoke and pet-free environment THE ROOM Your ",none,Location. Location. Location.,No smoking in unit or anywhere near the building. No pets. No excessive partying.,Public transit steps from the door.,"Shared bathroom, kitchen and living space. Private bedroom with twin beds.",I do like to interact with guests but lead a very busy life outside of home. Often we just pass in the hall as one goes in and out.,No smoking in the apartment or on the property. Not pets. No access to laundry. No food in the bedroom.,,,https://a0.muscache.com/im/pictures/9572488/7a8275fb_original.jpg?aki_policy=large,,2034186,https://www.airbnb.com/users/show/2034186,Jennifer,2012-03-29,"Toronto, Ontario, Canada","I am a professional living and working downtown. I love learning, travelling, meeting new people and experiencing life and grand adventures!  I have lived in 4 countries, travelled in 61 (and counting!) and want to continue to explore. While I am 'stuck' at home I look forward to meeting new people from all around the world. I am a very straight forward, open minded person with a full life outside of work. I can  give people alone time if they want but I also enjoy a great conversation too. ",within an hour,100%,90%,t,https://a0.muscache.com/im/pictures/user/32702dad-16e9-4263-a471-0cbea628aa35.jpg?aki_policy=profile_small,https://a0.muscache.com/im/pictures/user/32702dad-16e9-4263-a471-0cbea628aa35.jpg?aki_policy=profile_x_medium,Downtown Toronto,1,1,"['email', 'phone', 'reviews', 'offline_government_id', 'selfie', 'government_id', 'identity_manual']",t,f,"Toronto, ON, Canada",Downtown Toronto,Kensington-Chinatown,,Toronto,ON,M5T 1G4,Toronto,"Toronto, Canada",CA,Canada,43.65047,-79.39239,t,Condominium,Private room,2,1,1,2,Real Bed,"{TV,Internet,Wifi,""Air conditioning"",Kitchen,Heating,""Family/kid friendly"",""Smoke detector"",""Carbon monoxide detector"",""Fire extinguisher"",Essentials,Shampoo,Hangers,""Hair dryer"",Iron,""Laptop friendly workspace"",""Self check-in"",Lockbox,""Hot water"",Microwave,""Coffee maker"",Refrigerator,Oven,Stove,""Paid parking on premises""}",0,$93.00,,"$2,108.00",$250.00,$40.00,1,$25.00,1,200,1,1,200,200,1,200,3 months ago,t,10,37,63,153,2020-03-16,241,26,2012-09-09,2019-12-13,97,10,10,10,10,10,10,f,,,f,f,moderate,t,t,1,0,1,0,2.63
762143,https://www.airbnb.com/rooms/762143,20200316134823,2020-03-16,Hidden lakeview oasis downtown,Hidden gem in a quiet yet highly accessible location.  Fully furnished one bedroom ready for you to move into.  I love travelling and visiting other cities and the best way learn about the city is to stay at the place just where the locals stay and experience the city as it unfolds itself.,"Fully furnished one bedroom suite available on Queen's Quay West   Easy access to public transportations including the TTC, Island Ferry and the Island airport. Located at Spadina and Queen's Quay West it is steps to Harbourfront Centre Queen’s Quay Terminal shopping, Boardwalk, CN Tower and Rogers Centre.    The close proximity to St. Lawrence Market and a variety of grocery stores will put you within reach to fresh groceries. Be within steps to Toronto's great neighbourhoods such as, China Town, entertainment district and the financial district.  Take in the spectacular lakeview at your own private balcony after a long day. Enjoy the finest that downtown Toronto has to offer in this oasis within the bustle. Rate includes: Cable TV, 200GB hi-speed wi-fi internet, heat and hydro and bi-weekly housekeeping.  Fully equipped kitchen with dishwasher and ensuite washer and dryer.   Great amenities in the building: Gym, rooftop barbecue and lounge, party room, billiard room, visitor parking ","Hidden gem in a quiet yet highly accessible location.  Fully furnished one bedroom ready for you to move into.  I love travelling and visiting other cities and the best way learn about the city is to stay at the place just where the locals stay and experience the city as it unfolds itself. Fully furnished one bedroom suite available on Queen's Quay West   Easy access to public transportations including the TTC, Island Ferry and the Island airport. Located at Spadina and Queen's Quay West it is steps to Harbourfront Centre Queen’s Quay Terminal shopping, Boardwalk, CN Tower and Rogers Centre.    The close proximity to St. Lawrence Market and a variety of grocery stores will put you within reach to fresh groceries. Be within steps to Toronto's great neighbourhoods such as, China Town, entertainment district and the financial district.  Take in the spectacular lakeview at your own private balcony after a long day. Enjoy the finest that downtown Toronto has to offer in this oasis within th",none,"Great neighborhood to explore downtown Toronto but not have to be in the hustle and bustle of the city.  You are just steps away from the action(entertainment district, china town, financial district and the convention center).  It's also a great area to be especially if you enjoy running, biking or rollerblading.  There's a beautiful path around lake Ontario that you can explore! ",,TTC is right in front of the building great access to the subway system.  (to union station) or walking distance to Billy Bishop Airport,"Guest will have access to gym, hot tub and steam room.  Amenities(bbq, party room and billiard room will have to be reserved).",,Lease agreement has to be signed upon arrival to be submitted to the buildings property manager's office. No smoking in the suite only in the balcony. No Pets allowed.,,,https://a0.muscache.com/im/pictures/15001339/4817e105_original.jpg?aki_policy=large,,4017316,https://www.airbnb.com/users/show/4017316,Patricia,2012-10-30,"Toronto, Ontario, Canada",Traveled around the world and would love to share my home just like how I have enjoyed the experience in other people's home while I traveled.  Hope I can make you feel like home in this new city that you're visiting.  ,N/A,N/A,N/A,f,https://a0.muscache.com/im/users/4017316/profile_pic/1352318573/original.jpg?aki_policy=profile_small,https://a0.muscache.com/im/users/4017316/profile_pic/1352318573/original.jpg?aki_policy=profile_x_medium,Harbourfront,1,1,"['email', 'phone', 'facebook', 'reviews', 'jumio', 'government_id']",t,t,"Toronto, ON, Canada",Downtown Toronto,Waterfront Communities-The Island,,Toronto,ON,M5V 3T1,Toronto,"Toronto, Canada",CA,Canada,43.63757,-79.39253,t,Condominium,Entire home/apt,2,1,1,1,Real Bed,"{TV,""Cable TV"",Internet,Wifi,""Air conditioning"",Kitchen,Doorman,Gym,Elevator,""Hot tub"",""Buzzer/wireless intercom"",Heating,Washer,Dryer,""Smoke detector"",""Fire extinguisher"",Essentials,""24-hour check-in"",Hangers,""Hair dryer"",Iron,""Laptop friendly workspace"",""translation missing: en.hosting_amenity_49"",""translation missing: en.hosting_amenity_50"",""Hot water"",""Host greets you""}",595,$93.00,,"$2,200.00","$1,000.00",$75.00,2,$100.00,180,365,180,180,365,365,180,365,8 months ago,t,0,0,0,197,2020-03-16,6,0,2014-04-18,2017-06-03,80,9,8,9,9,8,8,f,,,f,f,strict_14_with_grace_period,f,f,1,1,0,0,0.08
783951,https://www.airbnb.com/rooms/783951,20200316134823,2020-03-16,King West designer 1 bedroom condo,"Located in the heart of the Fashion District, this apartment is in the most sought-after building in our beautiful neighbourhood.","• 24-hour concierge • Weekly house cleaning service • 9 foot exposed concrete  ceilings • 600 square feet of well-designed space + 100 sq feet balcony • Floor to ceiling windows • Stainless steel appliances • Stone Counters • Pre-Engineered hardwood floors • In-Suite laundry • Central Air & Heat • Fast WiFI • Recently upgraded furniture and new artwork • ""Walker’s Paradise"" - 97/100 Walk Score • ""Rider’s Paradise"" - 100/100 Transit score • Public pay parking in the building","Located in the heart of the Fashion District, this apartment is in the most sought-after building in our beautiful neighbourhood. • 24-hour concierge • Weekly house cleaning service • 9 foot exposed concrete  ceilings • 600 square feet of well-designed space + 100 sq feet balcony • Floor to ceiling windows • Stainless steel appliances • Stone Counters • Pre-Engineered hardwood floors • In-Suite laundry • Central Air & Heat • Fast WiFI • Recently upgraded furniture and new artwork • ""Walker’s Paradise"" - 97/100 Walk Score • ""Rider’s Paradise"" - 100/100 Transit score • Public pay parking in the building The whole apartment is accessible by guests. Available  via phone and email King West is for those seeking a true downtown Toronto experience. There's always something to do - the club scene is burgeoning and retail's on the rise, as well. The area is also highly walkable with easy-to-access public transit and even a few great green spaces equipped with off-leash dog parks.  One thing's f",none,"King West is for those seeking a true downtown Toronto experience. There's always something to do - the club scene is burgeoning and retail's on the rise, as well. The area is also highly walkable with easy-to-access public transit and even a few great green spaces equipped with off-leash dog parks.  One thing's for sure: if you're living on King West, you'll never be bored.",,Access to public transportation without crossing a street.  Public parking available in the building. Zipcar car sharing available in the building.,The whole apartment is accessible by guests.,Available  via phone and email,,,,https://a0.muscache.com/im/pictures/13056408/f965c6c6_original.jpg?aki_policy=large,,588352,https://www.airbnb.com/users/show/588352,Igor,2011-05-14,"Toronto, Ontario, Canada",Entrepreneur and world traveler,within a few hours,100%,100%,t,https://a0.muscache.com/im/users/588352/profile_pic/1346506838/original.jpg?aki_policy=profile_small,https://a0.muscache.com/im/users/588352/profile_pic/1346506838/original.jpg?aki_policy=profile_x_medium,Fashion District,1,1,"['email', 'phone', 'facebook', 'reviews', 'jumio', 'government_id', 'work_email']",t,t,"Toronto, ON, Canada",Downtown Toronto,Waterfront Communities-The Island,,Toronto,ON,M5V,Toronto,"Toronto, Canada",CA,Canada,43.64289,-79.39922,t,Condominium,Entire home/apt,2,1,1,1,Real Bed,"{TV,Wifi,""Air conditioning"",Kitchen,""Paid parking off premises"",Gym,Elevator,Heating,""Family/kid friendly"",Washer,Dryer,""Smoke detector"",""Carbon monoxide detector"",""First aid kit"",""Fire extinguisher"",Essentials,Shampoo,Hangers,""Hair dryer"",Iron,""Laptop friendly workspace"",""Self check-in"",""Building staff"",""Hot water"",""Bed linens"",""Extra pillows and blankets"",""Ethernet connection"",Microwave,""Coffee maker"",Refrigerator,Dishwasher,""Dishes and silverware"",""Cooking basics"",Oven,Stove,""Single level home"",""Patio or balcony"",""Luggage dropoff allowed"",""Long term stays allowed"",""Paid parking on premises""}",600,$130.00,$950.00,"$2,900.00",$0.00,$100.00,1,$0.00,30,90,30,30,1125,1125,30,1125,5 weeks ago,t,30,60,90,180,2020-03-16,13,2,2013-01-26,2019-10-16,97,10,9,10,10,10,10,f,,,f,f,strict_14_with_grace_period,f,f,1,1,0,0,0.15
