153000,https://www.airbnb.com/rooms/153000,20200316134823,2020-03-16,"1,100SqFt. 2B+Den Spacious Green Condo","Flourish in abeautiful 1,104 Sq. Ft. spacious technologically advanced luxury condo in the heart of Downtown Toronto.  Rest comfortably in a King & Queen size bed w/1,000 thread count linens in 2 large bedrooms with their own bathrooms on either side of the suite.  Keep connected and entertained with advanced technology and many amenities.  Live in the heart of downtown 10 minutes away from everything!  It's not an accommodation, it's your home.","Don't rent 2 hotel rooms, keep the family together or house 2 professionals lavishly with a beautiful 1,100 square foot luxury suite in the trendy heart of the Entertainment District in downtown Toronto surrounded by the Financial District, Harbourfront, Liberty Village, and the Fashion District.   This newly renovated spacious split-design 2 bedroom 2 bathroom + den is part of The Element, Toronto's first Green Condominium which is the first residential property in Toronto to use the EnWave lake water cooling system to save 90% of A/C energy costs. When you stay, you’ll enjoy a beautiful condo that’s very large by downtown's standards.  You'll rest very comfortably in 2 bedrooms that are on opposite sides for privacy.  The master bedroom has a King size bed, a large walk-in closet, a mini-desk w/bankers lamp and it's own private bathroom.  Also, the 2nd bedroom has a Queen size bed and its own washroom.  Envelop yourself in 1,000 thread count linens, plush bath, face, hand towels and ","Flourish in abeautiful 1,104 Sq. Ft. spacious technologically advanced luxury condo in the heart of Downtown Toronto.  Rest comfortably in a King & Queen size bed w/1,000 thread count linens in 2 large bedrooms with their own bathrooms on either side of the suite.  Keep connected and entertained with advanced technology and many amenities.  Live in the heart of downtown 10 minutes away from everything!  It's not an accommodation, it's your home. Don't rent 2 hotel rooms, keep the family together or house 2 professionals lavishly with a beautiful 1,100 square foot luxury suite in the trendy heart of the Entertainment District in downtown Toronto surrounded by the Financial District, Harbourfront, Liberty Village, and the Fashion District.   This newly renovated spacious split-design 2 bedroom 2 bathroom + den is part of The Element, Toronto's first Green Condominium which is the first residential property in Toronto to use the EnWave lake water cooling system to save 90% of A/C energy c",none,"In 1 block, you have a 24 hour small grocery store, various restaurants, a computer store, a nail salon and the Rogers Center, home of the Toronto Blue Jays.  In 2 blocks you have the Metro Toronto Convention Centre, King West Restaurant District, access to the underground PATH, and so much more.  I loved living there and you'll love it too.",The building is the first residential building in Toronto to use the Lakewater Cooling system.  This means the building uses the lake water as a air conditioner and not freon.  This results in a 90% reduction in energy consumption in the summer and dramatically reduces your carbon footprint just for your living.,"There is the Spadina Streetcar 1 block away, King St. Streetcar 2 blocks away and St. Andrew and Union Station 4 blocks away.  Available cabs & Uber pass the building every 1 to 5 minutes.  Yes, I said minutes. :-)  If you're driving, you're 1km from the main highway to get in and out of downtown.","Gym, 22nd Floor Terrace, Aqua Spa (Small Pool), 15 Seat Theatre","I'll give you a quick tour to check you in, check on you on the 2nd day, then just before you leave.","No smoking, no large pets",,,https://a0.muscache.com/im/pictures/967160/723eddbb_original.jpg?aki_policy=large,,735795,https://www.airbnb.com/users/show/735795,Raj,2011-06-23,"Toronto, Ontario, Canada","I'm house-sitting for my parents in another property and have made mine available to rent.  I've stocked it with all brand new accessories (kettle, dishes, cups, cutlery, pots, pans, linens, and more) and I've turned it into a beautiful rental suite you will enjoy.  Feel free to ask any questions, I have more information and pictures if you like.",within a day,100%,70%,f,https://a0.muscache.com/im/users/735795/profile_pic/1308849663/original.jpg?aki_policy=profile_small,https://a0.muscache.com/im/users/735795/profile_pic/1308849663/original.jpg?aki_policy=profile_x_medium,Entertainment District,1,1,"['email', 'phone', 'reviews', 'jumio', 'government_id']",t,t,"Toronto, ON, Canada",Downtown Toronto,Waterfront Communities-The Island,,Toronto,ON,M5V 3S8,Toronto,"Toronto, Canada",CA,Canada,43.64366,-79.39155,t,Condominium,Entire home/apt,4,2,2,2,Real Bed,"{TV,""Cable TV"",Internet,Wifi,""Air conditioning"",""Wheelchair accessible"",Pool,Kitchen,""Free parking on premises"",""Pets allowed"",Gym,Elevator,""Buzzer/wireless intercom"",Heating,""Family/kid friendly"",Washer,Dryer,""Smoke detector"",Essentials,""24-hour check-in"",Hangers,""Hair dryer"",Iron,""Laptop friendly workspace"",""Self check-in"",Lockbox,Bathtub,""Game console"",""Hot water"",Refrigerator,""Dishes and silverware"",""Long term stays allowed"",""Lake access""}",1100,$199.00,$999.00,"$3,499.00",$300.00,$150.00,4,$30.00,3,365,3,3,365,365,3,365,6 weeks ago,t,30,60,90,210,2020-03-16,54,4,2011-07-14,2020-01-30,90,9,8,9,9,10,9,f,,,f,f,strict_14_with_grace_period,f,f,1,1,0,0,0.51
179578,https://www.airbnb.com/rooms/179578,20200316134823,2020-03-16,Furnished 1+1 bed Condo Apartment,,"Fully furnished one bedroom plus one Den with one Bathroom available for short term tenancy. Central AC, One underground parking spot, gym, whirlpool, sauna, library, games room, billiard. 24/7 help desk counter. Walking distance to Main Bus Terminal, Scarborough Town Centre, RT Station. Ideal for a family, very neat and clean. No sharing, no pets allowed. You will own a full apartment during your stay.  Kitchen fully loaded with Fridge, Stove, Dishwasher & Washing Machine and Dryer also included. No kitchen utensils available on site.","Fully furnished one bedroom plus one Den with one Bathroom available for short term tenancy. Central AC, One underground parking spot, gym, whirlpool, sauna, library, games room, billiard. 24/7 help desk counter. Walking distance to Main Bus Terminal, Scarborough Town Centre, RT Station. Ideal for a family, very neat and clean. No sharing, no pets allowed. You will own a full apartment during your stay.  Kitchen fully loaded with Fridge, Stove, Dishwasher & Washing Machine and Dryer also included. No kitchen utensils available on site.",none,,,,,,,,,https://a0.muscache.com/im/pictures/2148b805-2169-4db0-bbbe-ec9374180ba3.jpg?aki_policy=large,,545074,https://www.airbnb.com/users/show/545074,Sohail,2011-04-29,Canada,"Mechanical Engineer, Married +2, 35 Years old, Non-Smooking, Mature, Descent.",N/A,N/A,N/A,f,https://a0.muscache.com/im/pictures/user/cfae1b2c-32e3-4cab-ac87-c46d5c566bff.jpg?aki_policy=profile_small,https://a0.muscache.com/im/pictures/user/cfae1b2c-32e3-4cab-ac87-c46d5c566bff.jpg?aki_policy=profile_x_medium,Scarborough City Centre,2,2,"['email', 'phone']",t,f,"Toronto, ON, Canada",Scarborough City Centre,Woburn,,Toronto,ON,M1H 3K2,Toronto,"Toronto, Canada",CA,Canada,43.78076,-79.24788,t,Condominium,Entire home/apt,4,1,2,2,Real Bed,"{TV,Internet,Wifi,""Air conditioning"",Pool,Kitchen,""Free parking on premises"",Gym,Elevator,""Hot tub"",Heating,""Family/kid friendly"",Washer,Dryer}",,$80.00,,,$200.00,$80.00,2,$10.00,2,31,2,2,31,31,2,31,52 months ago,t,0,0,0,0,2020-03-16,0,0,,,,,,,,,,f,,,f,f,strict_14_with_grace_period,f,f,2,2,0,0,
266300,https://www.airbnb.com/rooms/266300,20200316134823,2020-03-16,FURNISHED ONE-BDRM TORONTO KING W,DOWNTOWN CONDO AVAILABLE IN KING WEST -  MINIMUM 1 MONTH RENTAL.,"Beautifully furnished condo (600 sq ft) located on King St West, two blocks west of bathurst in downtown Toronto.  High-speed internet and utilities included, great balcony + BBQ, parking included, cleaning service included in one month rental.  Along the streetcar line, directly north of liberty village.  5 minute drive from CN Tower.","DOWNTOWN CONDO AVAILABLE IN KING WEST -  MINIMUM 1 MONTH RENTAL. Beautifully furnished condo (600 sq ft) located on King St West, two blocks west of bathurst in downtown Toronto.  High-speed internet and utilities included, great balcony + BBQ, parking included, cleaning service included in one month rental.  Along the streetcar line, directly north of liberty village.  5 minute drive from CN Tower. You will have access to the free underground parking space, the rooftop patio, the party room and the fitness room. I will be available by phone and email during the course of your stay and will have all situations resolved by myself or my girlfriend in very short order. King West has a great neighbourhood feel to it. Located 5 minutes from the CN tower, and right by other great neighborhoods, such as Queen West and Liberty Village, this is the ideal location to stay out of the busyness of the downtown core, while being right in the middle of the action. The condo is right along King Street",none,"King West has a great neighbourhood feel to it. Located 5 minutes from the CN tower, and right by other great neighborhoods, such as Queen West and Liberty Village, this is the ideal location to stay out of the busyness of the downtown core, while being right in the middle of the action.",,"The condo is right along King Street, making picking up a TTC at the base of the building extremely convenient for getting around the city. Multi-month stays include free condo cleaning once a month.","You will have access to the free underground parking space, the rooftop patio, the party room and the fitness room.",I will be available by phone and email during the course of your stay and will have all situations resolved by myself or my girlfriend in very short order.,,,,https://a0.muscache.com/im/pictures/c3b55f15-5d71-48b4-983c-6525fc6b7343.jpg?aki_policy=large,,1396237,https://www.airbnb.com/users/show/1396237,Jonathan,2011-11-11,"Toronto, Ontario, Canada",,within a few hours,100%,100%,f,https://a0.muscache.com/im/users/1396237/profile_pic/1321034199/original.jpg?aki_policy=profile_small,https://a0.muscache.com/im/users/1396237/profile_pic/1321034199/original.jpg?aki_policy=profile_x_medium,Niagara,1,1,"['email', 'phone', 'facebook', 'reviews', 'jumio', 'government_id']",t,t,"Toronto, ON, Canada",Niagara,Niagara,,Toronto,ON,M6K 0A1,Toronto,"Toronto, Canada",CA,Canada,43.64047,-79.41491,t,Condominium,Entire home/apt,2,1,1,1,Real Bed,"{TV,""Cable TV"",Internet,Wifi,""Air conditioning"",""Wheelchair accessible"",Kitchen,""Free parking on premises"",Doorman,Gym,Elevator,Heating,""Family/kid friendly"",Washer,Dryer,""Smoke detector"",""Carbon monoxide detector"",""First aid kit"",""Fire extinguisher"",Essentials,Shampoo,Hangers,""Hair dryer"",Iron,""Laptop friendly workspace"",""Self check-in"",""Building staff"",Bathtub,""Room-darkening shades"",""Game console"",""Hot water"",""Long term stays allowed""}",,$105.00,$600.00,"$2,500.00",$400.00,,1,$0.00,30,182,30,30,182,182,30,182,8 months ago,t,29,59,89,364,2020-03-16,5,2,2017-06-16,2019-06-11,100,10,10,10,10,10,10,f,,,f,f,strict_14_with_grace_period,f,f,1,1,0,0,0.15
268888,https://www.airbnb.com/rooms/268888,20200316134823,2020-03-16,Toronto  Downtown Quiet Area,,Available Friday and Saturday nights only Bright room with single bed and desk. Close to everything. Kitchen-continental breakfast available upon request. Quiet building.,Available Friday and Saturday nights only Bright room with single bed and desk. Close to everything. Kitchen-continental breakfast available upon request. Quiet building. Bedroom/Bathroom Loads of restaurants nearby Minimal Loads of restaurants nearby Public transit stops at front door No kitchen or lounge priviledges,none,Loads of restaurants nearby,No kitchen or lounge priviledges,Public transit stops at front door,Bedroom/Bathroom Loads of restaurants nearby,Minimal,,,,https://a0.muscache.com/im/pictures/2687534/e7a53166_original.jpg?aki_policy=large,,1408862,https://www.airbnb.com/users/show/1408862,Dale,2011-11-15,"Toronto, Ontario, Canada",,N/A,N/A,N/A,f,https://a0.muscache.com/im/users/1408862/profile_pic/1321371953/original.jpg?aki_policy=profile_small,https://a0.muscache.com/im/users/1408862/profile_pic/1321371953/original.jpg?aki_policy=profile_x_medium,Broadview North,1,1,"['email', 'phone', 'offline_government_id', 'government_id']",t,f,"Toronto, ON, Canada",Broadview North,Broadview North,,Toronto,ON,M4K 3Y2,Toronto,"Toronto, Canada",CA,Canada,43.6879,-79.35268,t,Condominium,Private room,1,1,1,1,Real Bed,"{Wifi,Kitchen,Breakfast,Elevator,""Free street parking"",Heating,Washer,Dryer,""Smoke detector"",""Carbon monoxide detector"",Essentials,""Hot water"",""Host greets you""}",80,$75.00,,,$150.00,$20.00,1,$0.00,1,2,1,1,2,2,1,2,39 months ago,t,29,59,89,364,2020-03-16,0,0,,,,,,,,,,f,,,f,f,flexible,f,f,1,0,1,0,
289239,https://www.airbnb.com/rooms/289239,20200316134823,2020-03-16,Big City Views from beautiful Queen West condo!,"My modern and bright condo is fully equipped to make for a very comfortable stay in the city. The location cannot be beat; close to a myriad of wonderful restaurants, bars and shops. Its park facing location makes for a quiet stay with spectacular views of the Toronto skyline.  Its close location to the streetcar stop and bike share program - make it easy to get around the city. I promise to make my home a wonderful place for your stay in TO! Let me know how I can help. Happy travels!!","1-bedroom + den condo in the heart of downtown Toronto, steps away from the streetcar + bikeshare for easy access to all parts of the city. Unobstructed views of downtown.  The boutique building looks over Stanley park.  Bright and cheerful with floor to ceiling windows and a small balcony with dining table. Fully equipped kitchen with espresso machine & dishwasher.  Large living space with 42inch flatscreen with cable.  Bedroom opens up to balcony with a new queen mattress is extremely comfortable.  There is a den available for you to sit at the desk and work or if you prefer, can be converted with an air mattress into another sleeping area.  The bathroom has a a soaker tub available. Washer & dryer is also in the unit if you would like to use it. Free wifi & cable.  Feel free to use the gym downstairs also. Parking is also available upon request. King West is one of the trendiest neighbourhoods in the city, dotted with plenty of restaurants, bars and patios. A 5 minute walk will take","My modern and bright condo is fully equipped to make for a very comfortable stay in the city. The location cannot be beat; close to a myriad of wonderful restaurants, bars and shops. Its park facing location makes for a quiet stay with spectacular views of the Toronto skyline.  Its close location to the streetcar stop and bike share program - make it easy to get around the city. I promise to make my home a wonderful place for your stay in TO! Let me know how I can help. Happy travels!! 1-bedroom + den condo in the heart of downtown Toronto, steps away from the streetcar + bikeshare for easy access to all parts of the city. Unobstructed views of downtown.  The boutique building looks over Stanley park.  Bright and cheerful with floor to ceiling windows and a small balcony with dining table. Fully equipped kitchen with espresso machine & dishwasher.  Large living space with 42inch flatscreen with cable.  Bedroom opens up to balcony with a new queen mattress is extremely comfortable.  The",none,"I love my neighbourhood.  I chose to live here because I love being close to the lake.  I love living on a park with unobstructed views of the gorgeous Toronto cityline.  I am close to an amazing selection of Bars, Restaurants and Cafes.  The option for yoga studios and fitness studios are endless and of course, there are the great shops of Queen West.  Oh, and how could I forget.  Trinity Bellwoods, my favourite park to picnic in!!  There is so much to discover in QueenWest, I am sure you will see for yourself!","Let me know if you have any questions before your arrival, I'm always happy to help make your stay more comfortable! Please let me know once you have arrived and settled in.","I am 200meters from the closest streetcar stop at King & Strachan. I am also 20meters away from the bike share Toronto program.  I use it all the time, its my preferred way to get around the city! Download the app to make travel in Toronto easy!  Uber is also a great option in the city.  Just let me know if I can help you find your way around the city!","The guests will have access to the entire home: bedroom, kitchen, living room, office, bathroom, den + patio. You can also use the building gym and outdoor space.  Let us know if your require parking, it’s also available on request.","I am always available if you need something while staying at my place!! The space is all yours to enjoy, but just reach out if I can make your time more comfortable. Best way to reach me is on email or (SENSITIVE CONTENTS HIDDEN).","Please feel at home while here, respect it like you would your own! Please let me know if you have any trouble while you are here and I am happy to help.  Accidents do happen, so please just let me know if anything has gone wrong during your stay. Thank you & enjoy your time here.",,,https://a0.muscache.com/im/pictures/3487400/465d79ca_original.jpg?aki_policy=large,,1270530,https://www.airbnb.com/users/show/1270530,Stephanie,2011-10-10,"Toronto, Ontario, Canada",Canadian with a love for travel!,within a few hours,100%,83%,t,https://a0.muscache.com/im/pictures/user/8e91f1aa-5271-4af4-bbc2-9db199084744.jpg?aki_policy=profile_small,https://a0.muscache.com/im/pictures/user/8e91f1aa-5271-4af4-bbc2-9db199084744.jpg?aki_policy=profile_x_medium,Niagara,1,1,"['email', 'phone', 'facebook', 'reviews', 'jumio', 'selfie', 'government_id', 'identity_manual', 'work_email']",t,f,"Toronto, ON, Canada",Niagara,Niagara,,Toronto,ON,M7A 2A9,Toronto,"Toronto, Canada",CA,Canada,43.64207,-79.40984,t,Condominium,Entire home/apt,2,1,1,1,Real Bed,"{TV,""Cable TV"",Internet,Wifi,""Air conditioning"",Kitchen,""Free parking on premises"",Gym,Elevator,""Buzzer/wireless intercom"",Heating,Washer,Dryer,""Smoke detector"",""Carbon monoxide detector"",Essentials,Shampoo,""Lock on bedroom door"",""24-hour check-in"",Hangers,""Hair dryer"",Iron,""Laptop friendly workspace"",""translation missing: en.hosting_amenity_49"",""translation missing: en.hosting_amenity_50"",""Private living room"",""Hot water"",""Bed linens"",""Extra pillows and blankets"",Microwave,""Coffee maker"",Refrigerator,Dishwasher,""Dishes and silverware"",""Cooking basics"",Oven,Stove,""Single level home"",""Patio or balcony"",""Long term stays allowed"",Other,""Paid parking on premises"",""Baking sheet"",""Trash can""}",,$199.00,$990.00,"$3,600.00",$0.00,$140.00,2,$0.00,10,365,10,10,365,365,10,365,7 weeks ago,t,0,0,13,123,2020-03-16,93,7,2012-03-08,2020-01-28,99,10,10,10,10,10,10,f,,,f,f,moderate,t,t,1,1,0,0,0.95
307726,https://www.airbnb.com/rooms/307726,20200316134823,2020-03-16,Boutique Chic at Maple Leaf Square,This is a private studio condo (no separate bedroom) ideal for one or two travelers in the throbbing heart of downtown Toronto. Amenities are abundant. The condo is extremely popular.  Please read full description below.,"Welcome to the Boutique Chic studio condo in the heart of downtown Toronto.  This small, beautifully appointed apartment is perfectly situated at the award-winning Maple Leaf Square where your world is simply an elevator ride away. The condo is linked to Canada's busiest transit hub, Union Station, with direct access to the TTC subway system, GO transit, the express UP train to and from Pearson Airport, and Via Rail. The building is also directly connected to 27 km of underground shopping and restaurants through the Toronto's PATH system. The building's amenities feature an indoor and outdoor pool, state-of-the-art gym, sauna, billiards room, business rooms with wireless internet, party room, media room, and 24 hour security and concierge. Maple Leaf Square is home to a 40-thousand square foot Longo's supermarket, with ready-made meals-to-go, as well as an LCBO Liqour store, TD Bank, Starbucks, Real Sports Bar and Grill and the fine-dining restaurant, ""e11even"". Paid underground parkin","This is a private studio condo (no separate bedroom) ideal for one or two travelers in the throbbing heart of downtown Toronto. Amenities are abundant. The condo is extremely popular.  Please read full description below. Welcome to the Boutique Chic studio condo in the heart of downtown Toronto.  This small, beautifully appointed apartment is perfectly situated at the award-winning Maple Leaf Square where your world is simply an elevator ride away. The condo is linked to Canada's busiest transit hub, Union Station, with direct access to the TTC subway system, GO transit, the express UP train to and from Pearson Airport, and Via Rail. The building is also directly connected to 27 km of underground shopping and restaurants through the Toronto's PATH system. The building's amenities feature an indoor and outdoor pool, state-of-the-art gym, sauna, billiards room, business rooms with wireless internet, party room, media room, and 24 hour security and concierge. Maple Leaf Square is home to ",none,"This is the most reasonably priced condo in the Maple Leaf Square building.  My husband and I pride ourselves on offering top-quality accommodations in the most incredible location downtown, at an attractive monthly rate.","Guests will be asked to sign the condo management's Resident Registration Form.  This enables property management to communicate with you throughout your stay in the unit, and also gives you access to all of the amenities and facilities at Maple Leaf Square.","The building is attached to the busiest transit hub in the country:  Union Station.  You can travel anywhere in Toronto via Union.  It is also home to the Union-Pearson express, the 25 minute train transporting travelers from the airport to Union station, at your doorstep.",This is a private condo.  It is solely for the use of the guests who book.  Guests have access to the apartment and all amenities in the building.,I am available 24/7 for any questions or concerns.,"*There is absolutely no smoking on the premises.  *Please remove shoes upon entering the condo.   *We respectfully ask that you do not have any overnight guests in the apartment. It is designed and sized for a maximum of two people. Two people in the unit is also the fire code regulation for the condo building. *Important: Please clean clothes dryer lint trap after every load of laundry.  This is a FIRE HAZARD if not cleaned.  If you don't understand what I am referring to, please ask. *If using the duvet on the bed, please protect it by placing a flat sheet underneath and on top to keep it clean. *A note about cleanliness: You should find the apartment spotless when you arrive. Please clean it during your stay - there are plenty of supplies under the sinks.  * Please use placemats and coasters provided.  * BEFORE YOU LEAVE, please do the following: *Do your dishes in dishwasher *Empty garbage cans  *Take linens off the bed for washing DO NOT put sheets in wash, simply remove from bed ",,,https://a0.muscache.com/im/pictures/d72c52d4-f10d-4594-a85b-79d114d204a3.jpg?aki_policy=large,,1108156,https://www.airbnb.com/users/show/1108156,Karen,2011-09-04,"Toronto, Ontario, Canada","I love traveling (especially to large cities) and whenever I can,  choose to stay in a house or apartment, because that's truly what gives you the experience of living like a local.

As a host I share the same feeling. I set up accommodations to make you feel right at home with all the amenities and convenience of enjoying Toronto as though you lived here.

I am a producer and writer for a variety of factual and documentary TV productions and a classical musician (for fun!)",within an hour,100%,100%,t,https://a0.muscache.com/im/users/1108156/profile_pic/1317565617/original.jpg?aki_policy=profile_small,https://a0.muscache.com/im/users/1108156/profile_pic/1317565617/original.jpg?aki_policy=profile_x_medium,Entertainment District,2,2,"['email', 'phone', 'reviews', 'jumio', 'government_id']",t,f,"Toronto, ON, Canada",Downtown Toronto,Waterfront Communities-The Island,,Toronto,ON,M5J 0A1,Toronto,"Toronto, Canada",CA,Canada,43.64222,-79.37987,t,Condominium,Entire home/apt,2,1,0,1,Real Bed,"{TV,""Cable TV"",Internet,Wifi,""Air conditioning"",""Wheelchair accessible"",Pool,Kitchen,""Paid parking off premises"",Doorman,Gym,Elevator,""Hot tub"",Heating,Washer,Dryer,""Smoke detector"",""Carbon monoxide detector"",Essentials,Shampoo,""24-hour check-in"",Hangers,""Hair dryer"",Iron,""Laptop friendly workspace"",""translation missing: en.hosting_amenity_49"",""translation missing: en.hosting_amenity_50"",""Self check-in"",Lockbox,""Private entrance"",Bathtub,""Hot water"",""Bed linens"",""Extra pillows and blankets"",Microwave,""Coffee maker"",Refrigerator,Dishwasher,""Dishes and silverware"",""Cooking basics"",Oven,Stove,""Single level home"",""Patio or balcony"",""Long term stays allowed"",Waterfront,""Lake access"",""Paid parking on premises""}",,$110.00,$550.00,"$2,050.00",$0.00,$0.00,1,$0.00,28,1124,7,28,1124,1124,14.7,1124,4 weeks ago,t,11,35,35,142,2020-03-16,58,9,2012-01-26,2019-11-02,99,10,10,10,10,10,10,f,,,f,f,strict_14_with_grace_period,t,t,2,2,0,0,0.59
